{
  "id": "req_core_step",
  "context": {
    "appId": "file-transformer"
  },
  "method": "core.step",
  "params": {
    "app": "file-transformer",
    "event": {
      "type": "TransformText",
      "payload": {
        "text": "Hello",
        "mode": "lowercase"
      }
    }
  },
  "timestamp": 1730000000000,
  "expected": {
    "ok": true,
    "resultSubset": {
      "ok": true,
      "stateVersion": 1,
      "actions": [
        {
          "type": "TransformText",
          "text": "hello"
        }
      ]
    }
  },
  "platforms": [
    "reference-host",
    "macos",
    "ios-simulator",
    "android-emulator",
    "windows",
    "linux",
    "server"
  ]
}
