{
  "id": "req_storage_remove",
  "context": {
    "appId": "notes-lite"
  },
  "method": "storage.remove",
  "params": {
    "key": "notes-lite:notes"
  },
  "timestamp": 1730000000000,
  "expected": {
    "ok": true,
    "resultSubset": {
      "ok": true
    }
  },
  "platforms": [
    "reference-host",
    "macos",
    "ios-simulator",
    "android-emulator",
    "windows",
    "linux",
    "server"
  ]
}
